Description,Score
"""I've lived in this apartment for 8 years now. It's just me and my daughter Lily who is 12. Her dad walked out on us when she was a baby, so it's just been the two of us getting by on my income working part-time at the grocery store. 

Things were tight but manageable until about 6 months ago when I started having really bad anxiety attacks. I've struggled with anxiety and depression my whole life, but it had been under control for years with medication and therapy. But I don't know, something just snapped and the anxiety became overwhelming. 

I had to take a leave from work, which meant no income coming in. I applied for disability benefits but it's a long process. We burned through what little savings we had pretty quickly trying to pay rent and bills. I just couldn't get on top of it, worrying about money just made the anxiety worse which made working or even applying for jobs impossible.

I kept meaning to go to the food bank or apply for other assistance, but just couldn't face leaving the apartment most days. Lily has been doing her best to help out around the apartment, making meals, doing chores. But she's just a kid, she shouldn't have to take care of me. I'm her mother, I'm supposed to be taking care of her.

I'm just so embarrassed and ashamed. I feel like I've failed as a parent, failed at being a responsible adult. I know I should have reached out for help sooner before it got this bad. Now we're being evicted and I have no idea what we're going to do or where we'll go. I've really messed this up.""",44
"""I'm a single mom with two kids under 10. I work part-time at a grocery store, but it's really hard to make ends meet. With rent, utilities, food, and everything else, I'm constantly behind on bills. 

This month, I got behind on the rent because I had to pay for new medication for my son's asthma. I know I should have notified the landlord, but I was embarrassed and hoping I could catch up next month. 

Then my car broke down, and I had to use what little savings I had to fix it so I could get to work. By the time I could scrape together most of the rent money, the landlord had already started eviction proceedings.

I tried explaining my situation, but he wouldn't budge. He said too many tenants use hard luck stories as excuses. Now I'm so stressed because I don't know where we'll go if we get evicted. Shelters are full, and I don't have any family nearby who can take us in. I cry myself to sleep some nights worrying about my kids ending up homeless.""

This account highlights some potential vulnerability factors like being a low-income single parent, having a child with a medical condition, unreliable transportation, and lack of familial support network. However, it leaves out labeling the tenant with a specific vulnerability score, instead illustrating their circumstances through their own words.",47
"""I'm so stressed out over this eviction notice. I lost my job back in March due to COVID layoffs at the factory where I worked. I've been struggling to make ends meet on just my disability check ever since. With my bad back, it's hard for me to find another physical labor job. 

I managed to pay partial rent most months by skimping on groceries and cutting out any extra expenses. But I got behind a couple months when my car needed a major repair that wiped out my meager savings. Public transportation is very limited in my area, so not having a car makes it extremely difficult to get to job interviews or appointments.

I tried explaining my situation to the landlord and made a payment plan to catch up the back rent, but they refused and filed for eviction instead. I have no family in the area to help me out. I'm just a single guy with no kids, so I don't qualify for most rental assistance programs. 

If I get evicted now, having that on my record will make it almost impossible to get approved for another apartment with my poor credit and lack of income. I could end up homeless at this rate. I'm terrified of losing my longtime home during this pandemic when shelters are overcrowded and unsafe. I don't know where I'll go or what I'll do.""",64
"""It's been a really tough year for me. Last fall, I lost my job at the factory when they had huge layoffs. I was out of work for 4 months before finally finding a new job as a cashier at the grocery store. But it doesn't pay nearly as much as my old job. 

With the reduced income, it's been a constant struggle to make ends meet and pay all the bills on time. I've gotten behind on the rent a few times, but have managed to catch up eventually by picking up extra shifts. 

However, two months ago my hours were cut back at work due to staffing changes. I fell really behind on the rent again. I'm doing everything I can, but I've had to make tough choices between paying rent, groceries, utilities, etc. I just don't have enough money coming in right now.

To make matters worse, my son who's 8 years old has been having some health issues. He has asthma and the medication isn't cheap with my health insurance. He missed a lot of school this year because of asthma attacks. I'm a single mom, and it's been incredibly stressful trying to manage everything on my own.

I did explain my situation to the landlord and I thought they were working with me. But then last week, I received an eviction notice for non-payment of rent. I'm so stressed and don't know what I'm going to do. I have nowhere else to go with my son if we get evicted from our apartment. I've been looking for a second job, but it's not easy juggling everything.""",67
"""It all started when my hours got cut back at work last year. I've been a cashier at the grocery store for 8 years, but they had to let some people go due to the pandemic. I went from working 35 hours a week down to 20 hours. My rent is $950 a month for this one-bedroom apartment. 

With the reduced income, it's been really tough to make ends meet. I've fallen behind on the rent the last few months. The late fees just keep piling up too. I owe over $2,000 to the landlord now between back rent and fees. 

I've tried to pick up some side gigs like driving for a food delivery service, but it's not enough. I'm a single mom, and my 10-year-old son has some learning disabilities. He needs extra help with school through a tutoring program that costs $200 a month. I can't afford to stop paying for that.

I've been putting off going to the doctor because I don't have health insurance and the copays are so expensive. But I've been having terrible migraine headaches that make it hard to work somedays. 

I feel stuck. I don't have any family nearby who can help me. The churches and nonprofits I've asked said their rental assistance funds are all tapped out. I'm doing my best, but I'm just unable to catch up on the back rent right now. I'm so stressed wondering if we're going to end up homeless.""",67
"My name is Marcus and I'm 28 years old. I'm being evicted from my apartment because I lost my job six months ago and haven't been able to pay the rent. It's just been one thing after another for me. 

I worked as a line cook at a restaurant downtown, but they had to shut down during the pandemic. Since then, I've applied for over 100 jobs with no luck. I don't have any family who can help me out financially. My mom passed away when I was young and I never knew my dad. 

I dropped out of high school when I was 16 to work full-time after my mom got sick. I never went back to get my diploma. With just a basic education and no special skills, it's been really tough finding work. 

On top of that, I struggle with depression and anxiety. I take medication for it, but it's still hard. Some days I can barely get out of bed. I've had a couple runs-in with the law related to incidents where I was drunk and disorderly. Nothing too serious, but it's another strike against me.

I've been couch surfing with friends the last couple months since I got the eviction notice. I don't know what I'm going to do. I applied for unemployment benefits and food stamps, but it hasn't been enough to cover the back rent I owe. I'm feeling pretty hopeless and alone right now.",9
"""I'm a single mother of two kids, ages 8 and 5. My youngest has severe asthma, and the conditions in our apartment have been making it worse. There's mold growing in the bathroom and kitchen, and the landlord hasn't done anything about it, despite my repeated requests. 

Last month, I had to take my son to the emergency room because of an asthma attack, and the doctor said the mold could be a trigger. I tried to explain the situation to the landlord, but he just brushed me off and said it was my problem.

On top of that, my hours at work have been cut back, and I'm struggling to make ends meet. I fell behind on rent for a couple of months, but I've been trying to catch up. I even took on a second job, but it's been tough juggling everything.

Now, the landlord is trying to evict us. I don't know what I'm going to do. I can't afford to move, and finding a place that's safe for my son's asthma is going to be really difficult. I'm so stressed out, and I feel like I'm failing my kids.""

In this account, the tenant is facing multiple vulnerabilities, including health issues with her child, financial instability due to reduced work hours, and potential homelessness due to the eviction. The mold in the apartment is exacerbating her child's asthma, and the landlord's lack of responsiveness to her requests for repairs adds to her difficulties. The stress of juggling work and caregiving responsibilities while facing eviction paints a picture of a vulnerable tenant in a challenging situation.",83
"I'm not really sure why I'm being evicted to be honest. I've always paid my rent, even if it was a little late sometimes when money was tight. But the landlord said he's terminating my lease for repeated late payments.  

It's true that over the past year or so, I've been having some issues keeping up with everything. My wife lost her job during the pandemic and money has been really tight while she's been looking for a new job. With just my salary, it's been a struggle to cover all the bills on time every month.

On top of that, my elderly mother's health has been declining and I've had to take her to a lot of medical appointments and help care for her when I'm not at work. It's been stressful juggling everything.

I did fall behind on a couple rent payments when things were really bad, but I always paid the late fees and got caught up eventually. I don't think it was that big of a deal to warrant evicting me. But I guess the landlord has decided he's done with me as a tenant.

I've lived in this apartment for 8 years. It's gonna be really hard to find a new affordable place, especially on short notice like this. I'm not sure what I'm gonna do. I may have to move in with my brother temporarily until I can get back on my feet financially. This whole situation is just a mess and has me pretty down. I really wish the landlord would reconsider and let me stay.",21
"""I'm so stressed out, I can barely sleep at night. I got the eviction notice last week and my heart just sank. I've lived in this little apartment for 8 years - it's not much, but it's home. 

I lost my job back in March when the pandemic hit. I worked as a server at a restaurant downtown and they had to let almost everyone go. I filed for unemployment right away but it took months for the payments to finally start coming in. By then, I was already so behind on rent. 

My landlord seemed understanding at first when I explained the situation, but then he got really impatient and started sending me late notices and threats to evict. I've been paying what I can with my unemployment, but it hasn't been enough to cover the full rent, let alone catch up on what I owe.

On top of that, my son's asthma has been really bad lately. He's had to go to the ER a couple times in the last few months. The medical bills have been piling up too. I'm doing my best but I'm completely overwhelmed trying to take care of him, find a new job, and deal with this eviction. 

I don't know what I'll do if I lose this place. My family lives across the country and I can't just move back in with them. I'm so scared of becoming homeless, especially with my son's health issues. I wish my landlord could see how hard I'm trying and give me just a little more time. But the eviction hearing is next week and I'm terrified.""",36
"""I'm sorry, I know I'm behind on rent again. It's been really tough lately. My hours got cut back at the grocery store because they had to make some layoffs. I'm only getting about 25 hours a week now instead of the full-time schedule I used to have. 

On top of that, my son Jamie has been having a really hard time in school. He's been acting out and having behavioral issues. The school counselor recommended we get him into therapy, but that costs money we just don't have right now. My ex hasn't been paying his child support regularly, so it's all fallen on me.

I've been taking on some side gigs like dog walking and cleaning houses when I can, but it hasn't been enough to cover everything. With my reduced income, something had to give. I thought I could get back on track with the rent, but then my car broke down and I had to pay for those repairs. 

I'm so stressed and anxious all the time. I've been having trouble sleeping, which makes it hard to get through my shifts at work. I have to be there for Jamie, but I'm just stretched so thin. I don't know what I'll do if we lose our apartment. We don't have any family in the area to stay with. Please, if you can give me just a few more weeks, I'm sure I can catch up. I'll pick up extra shifts wherever I can. I'm just asking for a little understanding during this difficult time.""",87
"My name is Maria and I'm a single mom with two kids - a 7-year-old son and a 3-year-old daughter. I've lived in this apartment for 5 years. It's nothing fancy but it's been a stable home for my little family. 

About 8 months ago, I lost my job at the grocery store due to some health issues. I have chronic pain from a back injury a few years ago that flares up sometimes and makes it hard for me to be on my feet all day. I tried to get on disability benefits but I was denied. Without a steady income, I quickly fell behind on the rent.

I've been looking hard for a new job that works with my limitations, but it's been really tough. In the meantime, my savings dwindled away just trying to keep a roof over our heads and food on the table. The kids' dad isn't really in the picture. 

I feel like I've been juggling a million balls trying to take care of my kids, deal with my health issues, look for work, and figure out how to dig myself out of this hole. Some days it's overwhelming and I don't know where to turn. But I'm doing my absolute best.

I fell about 4 months behind on rent despite getting rental assistance for part of the missed payments. Now the landlord has started eviction proceedings against me. I'm scared we'll end up homeless. I don't know what I'll do then. I'm desperate to get back on my feet, but I need some more time. I don't want to uproot my kids from their school and neighborhood. This apartment is our home.",70
"""I'm so overwhelmed and ashamed about this eviction situation. My name is Maria and I'm a single mom raising two kids - Tommy who's 8 and Lily who's 5. Their dad walked out on us a few years ago and provides no financial support. 

I work as a home health aide but the hours are inconsistent and the pay isn't great. I can barely make ends meet as it is. A few months ago, I started having severe panic attacks and anxiety. The stress of being a single parent, working unpredictable hours, and money troubles just became too much. I had to start seeing a therapist and got prescribed medication, which has helped somewhat but also made me very fatigued and unfocused at times.

With my inconsistent income, I started falling behind on rent. I tried explaining my situation to the landlord and requested a payment plan, but they refused and moved ahead with eviction proceedings. I've lived in this apartment for 6 years and have been a good tenant otherwise. But now I'm facing homelessness with my two young kids unless I can get an extension or rental assistance. 

I'm at my wits' end and so anxious about having to uproot the kids from their school, friends and neighborhood they've known their whole lives. I don't know where we'll go or how I'll get back on my feet. I've never felt so hopeless and afraid for their future. I'm doing my best but struggling so much with my mental health too. I just need some understanding and a little more time to get the money together or find a new place we can afford.""

This tenant's account highlights several key vulnerability factors like being a struggling single parent, having young children, facing mental health issues, inconsistent low-income employment, and the threat of homelessness. Her story demonstrates the overwhelming stress and difficulties that can lead to an eviction situation for those with multiple complex challenges. An empathetic lawyer could identify her high degree of vulnerability based on the details she provides.",88
"""My name is Maria. I'm a single mom with two kids, ages 5 and 7. I've been living in this apartment for 3 years. It's been really hard making ends meet ever since I lost my job at the factory last year due to COVID layoffs. I've been doing gig work and odd jobs when I can, but it's not steady income. 

I fell behind on the rent about 6 months ago. I tried explaining my situation to the landlord, but they were really impatient and unwilling to work with me on a payment plan. I got an eviction notice last month saying I have to be out in 30 days. 

I've been looking for a new place, but it's almost impossible to get approved with my spotty employment history and eviction record now. My kids have already had to switch schools twice in the last year due to my unstable housing. I'm so stressed and depressed, I don't know what I'm going to do. 

I don't have any family nearby who can take us in. The local shelters are full. I make just enough to not qualify for most rental assistance programs. I'm stuck in a impossible situation and about to become homeless with two young kids. I don't know how I'm going to keep my family safe and together. I'm at my wit's end.""",88
"My name is Michael and I'm being evicted from my apartment that I've lived in for the past 3 years. I'll be honest, I haven't been the best tenant. I've had friends over regularly for parties until late at night, despite several warnings from the building manager about the noise complaints. A couple times I drunkenly got into shouting matches with neighbors in the hallway over parking spaces or whatever stupid thing seemed important at 2am. 

I also hadn't paid rent for the last 4 months. I know that's really bad, but I just haven't had the money lately. I lost my job waiting tables back in November after getting into an argument with my boss. Instead of looking for a new job right away, I figured I could just live off my savings for a while, order food every night, buy some new video games, etc. Before I knew it, most of my money was gone without me ever getting a new job lined up.

When the property manager started sending eviction notices, I just kind of ignored them thinking I could shake the landlord down for more time if I played dumb. But then the court hearings started and I still didn't have any good excuse for not paying, so I pretty much knew it was a lost cause at that point. I could have tried getting a loan from my parents, but I didn't want to admit to them how irresponsible I'd been.

So that's where I'm at - getting evicted this week because I made some pretty bonehead mistakes and choices. While it sucks to have to move everything out, it's probably for the best. I need to grow up and get my life together. Hopefully this is the wake up call I need.",12
"""I'm so stressed out about this eviction notice. I've lived in this apartment for 8 years and have always paid my rent on time until the last few months. Things just got really tough financially after I lost my job back in March. The company I worked for downsized because of the pandemic, and I haven't been able to find another job yet despite applying everywhere. 

My unemployment benefits barely cover rent, let alone utilities, food, and my medication copays. I have type 2 diabetes that's pretty well controlled with medication, but I can't afford to let my prescriptions lapse. I also help support my 75-year-old mother who lives alone. Her social security isn't enough to make ends meet, so I give her what I can each month for her expenses. 

I've fallen behind on rent the last three months. I keep getting notices from the landlord threatening eviction if I don't pay in full immediately. But I literally don't have the money. I've asked for an extension or a payment plan, but they won't budge. I'm so worried that my mom and I will end up homeless. This situation is making my diabetes worse from the stress. I don't know where to turn for help.""",58
"""I'm a single mom with two kids - a 7-year-old daughter and a 5-year-old son. I work part-time at a grocery store deli, but it's tough making ends meet on my own. The rent for our little two-bedroom apartment is over half my monthly income. 

I fell behind on rent a few months ago when my car broke down and I had to pay a huge repair bill. I used what little savings I had for that. I've been scrambling ever since, trying to catch up. 

I spoke to my landlord and he agreed to let me pay double rent for a couple of months to get caught up. But then my son got really sick - he has asthma and ended up in the hospital for a few days. More bills piled up with the hospital stay and I missed another rent payment.

Now the landlord is trying to evict me. I'm so stressed and don't know what to do. I can't afford to move somewhere else right now. And being evicted would make it even harder to find a new place with my credit and rental history. My kids don't deserve to be put out on the street over this. I'm doing the best I can but it never seems to be enough.""",65
"""My name is Maria and I'm a single mother of three young kids - ages 5, 7, and 9. I work two jobs to try to make ends meet, but it's a constant struggle. One job is as a cashier at a grocery store during the day, and the other is cleaning office buildings at night. Between the two jobs, I make around $2,000 per month after taxes. 

But the rent for our small two-bedroom apartment is $1,400 a month, not including utilities. Plus I have car payments, insurance, food, clothes for the growing kids, and all the other expenses that come with raising a family. Some months I get behind and then I'm playing catch up the next month. 

I admit I've been late on rent the past few months. It's not for lack of trying - I pick up extra shifts whenever I can. But sometimes one of the kids gets sick, or I have an unexpected car repair, and that little financial emergency sets me back. I know being consistently late violates my lease terms.

On top of that, my oldest has ADHD and has had some behavioral issues at school this year, which has been really stressing me out and making it hard to focus at my jobs. I'm doing the best I can, but I can totally understand why my landlord is frustrated and wants to evict us. I just don't know where we'll go - the housing market is so expensive here and there's nowhere else in my budget. I'm at my wit's end.""

This account highlights several potential vulnerability factors like being a struggling single parent, having a low income, having high rent burden, dealing with a child's disability/behavioral issues, and lack of affordable housing options. However, it is portrayed in a matter-of-fact way as the tenant's own words rather than explicitly stating a vulnerability score. The goal is to train lawyers to identify these types of real-world vulnerability signs themselves.",39
"""I'm so stressed out, I don't know what I'm going to do. The landlord is trying to evict me and my kids over some missed rent payments. I lost my job back in March when the COVID shutdowns hit. I was working part-time at a restaurant downtown and they just had to let me and a bunch of others go with no warning. 

I applied for unemployment benefits right away but it took over 2 months for that to finally come through. In the meantime, I had no income at all and could barely afford food, let alone rent. I kept calling and explaining the situation to the property manager but they didn't care - they just wanted their money.

Now I'm playing catch up but it's impossible. Even with my unemployment checks, I'm still behind on rent after covering other bills that piled up. My youngest has asthma and we couldn't let our health insurance lapse so I had to prioritize that. But now the landlord is taking me to housing court over $2,500 in back rent.

I'm a single mom without any family in the area to help out. My parents live across the country. I have no savings to speak of. I cry myself to sleep every night worried about becoming homeless and what that would mean for my kids' safety. I'm doing everything I can but I'm at the end of my rope here. I don't know what else to do - I feel so helpless and alone in this situation. Please, is there any way to stop this eviction?""",87
